{
  "date": "2026-02-27",
  "title": "AI领域结构性变化信号分析",
  "core_insight": "今日新增的AI信息显示，技术层面上有多项重大突破，基础设施层面上推理成本和芯片/算力趋势有所变化，应用层面上AI进入了新行业和新场景，资本信号显示融资方向和估值水平有所变化，风险信号显示监管/立法和伦理/安全领域有新动向",
  "dimension_texts": {
    "technology": "新模型和算法的提出，如GPT-5.2和GPT-5.3-Codex-Spark，推动了模型能力边界的突破 新的范式如2-Step Agent和Semantic Partial Grounding via LLMs的提出 2-Step Agent: A Framework for the Interaction of a Decision Maker with AI Decision Support Semantic Partial Grounding via LLMs",
    "infrastructure": "推理成本有所降低，如GPT-5.3-Codex-Spark的15x更快的生成速度 芯片/算力趋势显示新硬件的发布，如Gemini 3 Flash Introducing GPT-5.3-Codex-Spark Gemini 3 Flash: frontier intelligence built for speed",
    "application": "AI进入了新行业和新场景，如Figma与OpenAI的合作 AI开始替代旧的解决方案，如Gushwork的AI搜索工具 Figma partners with OpenAI to bake in support for Codex Gushwork bets on AI search for customer leads — and early results are emerging",
    "capital": "融资方向显示了明显的变化，如Trace的3M美元种子轮融资 估值水平有所变化，如Anthropic的估值增长 大厂战略动向显示了明显的变化，如Anthropic的收购 Trace raises $3M to solve the AI agent adoption problem in enterprise Anthropic acquires computer-use AI startup Vercept after Meta poached one of its founders",
    "risk": "监管/立法领域有新动向，如对AI安全和伦理的关注 伦理/安全领域有新动向，如对AI偏见和安全性的讨论 供应链/地缘风险没有明显的变化 Gemma Scope 2: helping the AI safety community deepen understanding of complex language model behavior Language Models Exhibit Inconsistent Biases Towards Algorithmic Agents and Human Experts",
    "_combined": "今日新增的AI信息显示，技术层面上有多项重大突破，基础设施层面上推理成本和芯片/算力趋势有所变化，应用层面上AI进入了新行业和新场景，资本信号显示融资方向和估值水平有所变化，风险信号显示监管/立法和伦理/安全领域有新动向 AI领域结构性变化信号分析 新模型和算法的提出，如GPT-5.2和GPT-5.3-Codex-Spark，推动了模型能力边界的突破 新的范式如2-Step Agent和Semantic Partial Grounding via LLMs的提出 2-Step Agent: A Framework for the Interaction of a Decision Maker with AI Decision Support Semantic Partial Grounding via LLMs 推理成本有所降低，如GPT-5.3-Codex-Spark的15x更快的生成速度 芯片/算力趋势显示新硬件的发布，如Gemini 3 Flash Introducing GPT-5.3-Codex-Spark Gemini 3 Flash: frontier intelligence built for speed AI进入了新行业和新场景，如Figma与OpenAI的合作 AI开始替代旧的解决方案，如Gushwork的AI搜索工具 Figma partners with OpenAI to bake in support for Codex Gushwork bets on AI search for customer leads — and early results are emerging 融资方向显示了明显的变化，如Trace的3M美元种子轮融资 估值水平有所变化，如Anthropic的估值增长 大厂战略动向显示了明显的变化，如Anthropic的收购 Trace raises $3M to solve the AI agent adoption problem in enterprise Anthropic acquires computer-use AI startup Vercept after Meta poached one of its founders 监管/立法领域有新动向，如对AI安全和伦理的关注 伦理/安全领域有新动向，如对AI偏见和安全性的讨论 供应链/地缘风险没有明显的变化 Gemma Scope 2: helping the AI safety community deepen understanding of complex language model behavior Language Models Exhibit Inconsistent Biases Towards Algorithmic Agents and Human Experts"
  },
  "keywords": [
    "LLM",
    "GPT-5.2",
    "GPT-5.3-Codex-Spark",
    "Gemini 3 Flash",
    "Gemma Scope 2",
    "Codex",
    "Claude",
    "Anthropic",
    "OpenAI",
    "DeepMind",
    "Meta AI"
  ]
}